廣州街南門國小,121.5090739,25.03536212
廣州街8巷,121.5083189,25.03555332
衡陽路博愛路,121.5114788,25.0422698
衡陽路懷寧街,121.5140223,25.04234839
襄陽路懷寧街,121.514088,25.04345589
襄陽路館前路,121.5150431,25.04342752
襄陽路公園路,121.5166475,25.04328998
濟南路一段鎮江街,121.5209875,25.04283854
濟南路一段林森南路,121.5226039,25.04241915
濟南路一段紹興南街,121.5243317,25.0419348
濟南路一段杭州南一段,121.526091,25.04158112
濟南路二段金山南一段,121.5291228,25.04086094
濟南路二段48巷,121.5311322,25.04035231
金山南一段銅山街,121.528729,25.03944343
博愛路永綏街,121.5114987,25.04307333
寶慶路博愛路,121.5114109,25.04121733
寶慶路桃源街,121.5104256,25.04134265
羅斯福一段寧波西街,121.5191143,25.03163781
羅斯福一段南海路,121.5181116,25.03291521
羅斯福一段福州街,121.5204426,25.02974644
民權西路天祥路,121.5208396,25.06283647
復興北路錦州街,121.5442264,25.06015453
復興北路興安街,121.5441058,25.05603613
復興北路長春路,121.5441007,25.05456257
復興北路朱崙街,121.5439187,25.04990183
南京東三段復興北路,121.5440466,25.05181629
長安東二段復興北路,121.54396,25.0482563
民生東三段復興北路,121.5441678,25.05774119
遼寧街128巷,121.5420802,25.05334771
八德路二段復興北路,121.5439289,25.0475583
復興北路141巷,121.5440194,25.05331178
南京東三段龍江路,121.5404509,25.05191824
南京東三段遼寧街,121.5420293,25.05188865
長安東二段龍江路,121.5404117,25.04832845
長安東二段八德路2段199巷,121.539063,25.04831357
長安東二段遼寧街,121.5421477,25.04829196
民生東三段龍江路,121.5406559,25.05780334
民生東三段合江街,121.5391701,25.05782977
市民三段復興南一段,121.5439037,25.04481564
朱崙街龍江路,121.5404376,25.04998903
龍江路中正國小,121.5404477,25.05064034
八德路二段遼寧街,121.542183,25.04713789
朱崙街遼寧街,121.5421879,25.0499649
長春路遼寧街,121.5421041,25.05462129
興安街遼寧街,121.5421377,25.05606576
民生東三段遼寧街,121.5421815,25.0577817
長春路合江街,121.5390635,25.05468874
興安街合江街,121.5391306,25.05614023
錦州街合江街,121.5392152,25.06022178
錦州街龍江路,121.5407454,25.06022599
新生北二段錦州街,121.5276885,25.06031973
林森北路錦州街,121.5255657,25.06027783
中山北二段錦州街,121.5229635,25.06031287
錦州街中原街,121.5289475,25.06033393
錦州街吉林路,121.5302562,25.06029996
吉林路松江路330巷,121.5302583,25.06118432
松江路錦州街,121.5331828,25.06033512
錦州街267號,121.5348577,25.06030858
建國北二段錦州街,121.5369982,25.0602884
長春路龍江路,121.5404992,25.0546264
長春路吉林路,121.5301507,25.05484626
長春路一江街,121.531537,25.05483652
長春路吉林國小,121.5296205,25.05485795
長春路松江路,121.533075,25.05480703
長春路163巷,121.5336378,25.05480365
長春路伊通街,121.5348084,25.05477502
建國北二段長春路,121.536832,25.05475918
中山北二段長春路,121.5226658,25.05498097
林森北路長春路,121.525461,25.05492502
新生北二段長春路,121.5274332,25.05489783
南京東二段吉林路,121.5300796,25.05203336
南京東二段21巷,121.5287773,25.05205127
南京東二段一江街,121.5314784,25.05201044
南京東二段松江路,121.5330418,25.0519901
南京東二段伊通街,121.5347814,25.05199033
南京東二段建國北一段,121.5367502,25.0519637
南京東一段中山北一段,121.5225211,25.05221359
南京東一段林森北路,121.5253899,25.05211821
南京東一段新生北二段,121.5276907,25.05212608
建國南一段市民三段,121.5366203,25.04476227
八德路二段建國北一段,121.5366632,25.04607047
長安東二段建國北一段,121.5366946,25.04837408
建國北一段88巷(迴轉道),121.5367709,25.04956841
建國北二段興安路,121.5368756,25.05619607
民生東二段建國北二段,121.536913,25.05788627
民權東二段建國北二段,121.5370247,25.06239124
民生東一段中山北二段,121.5228217,25.05789578
民生東一段林森北路,121.5254955,25.05805217
民生東一段23巷,121.5240808,25.05804328
民生東一段新生北二段,121.5275721,25.05800751
民生東二段吉林路,121.5302233,25.05795219
民生東二段松江路,121.5331345,25.05790236
民生東二段147巷,121.5348592,25.05790563
民生東二段中原街,121.5288975,25.05800056
民生東二段132巷,121.5318642,25.05793619
民生東二段115巷,121.5315898,25.05793628
民權東一段林森北路,121.525631,25.0626668
新生北二段(新興國中後),121.5275163,25.06162703
民權東一段新生北二段,121.5277248,25.06261087
民權東一段中山北二段,121.5226058,25.06274429
民權東一段雙城街,121.524277,25.06272779
民權東二段松江路,121.5331978,25.06247707
民權東二段吉林路,121.5302904,25.06253705
民權東二段中原街,121.528966,25.06259413
民權東二段135巷,121.5349117,25.06245541
民權東二段71巷,121.5317005,25.06251387
民權東三段39、60巷,121.5424633,25.06234609
民權東三段龍江路,121.5408117,25.06231075
民權東三段復興北路,121.5442484,25.06219787
長安東二段吉林路,121.5299885,25.04851812
新生北一段吉林路10巷,121.5286625,25.04992982
吉林路10巷(長安國小),121.5300187,25.04972661
吉林路14巷,121.5300427,25.05052345
四平街吉林路,121.5301156,25.05366044
吉林路144、181巷,121.5301631,25.05605449
農安街吉林路,121.5303554,25.06481577
德惠街吉林路,121.5304171,25.06657977
民族東路吉林路,121.5304587,25.0682646
北安路55號,121.5290051,25.07780194
中山北四段北安路,121.5270757,25.07641676
北安路海總西側,121.5350162,25.07792698
北安路明水路(海總前),121.5389854,25.07769359
北安路87巷,121.5302775,25.07799184
北安路海總正門,121.5380229,25.07773726
北安路海總東側門,121.539077,25.07940733
北安路通北街,121.5410839,25.07949562
北安路大直橋,121.5444349,25.07968859
北安路458巷大直橋下,121.544615,25.07788704
北安路大直街,121.5470622,25.07983019
北安路554巷,121.5481693,25.08048139
北安路588巷,121.5485829,25.08118842
北安路595、608巷,121.5487972,25.08205765
明水路北安路670巷,121.5507894,25.0837607
北安路630巷,121.5490174,25.08284886
北安路670巷,121.5493256,25.08408714
北安路敬業三路,121.556329,25.08464056
北安路劍南路,121.5538853,25.08536209
北安路明水路(隧道前),121.552594,25.08570288
北安路自強隧道,121.5494004,25.08586041
北安路圓環南側,121.5502251,25.08523055
北安路圓環北側,121.5503812,25.08618795
北安路518巷458巷41弄,121.5462118,25.07904781
北安路554巷8弄,121.5503028,25.07999122
北安路554巷永安國小,121.5493607,25.08001209
明水路397巷19弄永安國小,121.5496177,25.07860838
北安路554巷578巷8弄,121.548622,25.08014622
北安路621巷大直街,121.5463438,25.08291249
民族東路410巷龍江路356巷,121.5382908,25.06598941
民族東路建國北三段113巷,121.5363632,25.06815352
民族東路410巷2弄建國北路2段113巷(單閃),121.5362366,25.06676708
民族東路復興北路,121.5442923,25.06640258
民族東路540號,121.5432764,25.06716869
民族東路雙城街,121.5246395,25.06839951
民族東路410巷,121.5382859,25.0681389
民族東路龍江路,121.5410299,25.06813566
民族東路林森北路,121.5257717,25.06835852
新生北三段民族東路,121.5278715,25.06833299
民族東路松江路,121.5332348,25.0682108
中山北三段民族東路,121.5228747,25.06843869
渭水街松江路,121.5328894,25.04585093
市民三段松江路,121.5328721,25.04540613
松江路25巷,121.5328994,25.04705706
長安東二段松江路,121.5329003,25.04844641
松江路85巷,121.5329786,25.05016238
一江街松江路90巷,121.5314595,25.05050476
四平街松江路,121.5330158,25.05362689
農安街松江路,121.5332512,25.06474771
農安街民權東路2段135巷,121.5350316,25.06462055
德惠街松江路,121.5332618,25.06651862
市民二段長安東一段30巷,121.5260405,25.04759304
長安東一段77、52巷,121.5281088,25.04830721
長安東一段新生北一段,121.5296066,25.0482301
市民二段長安東一段52巷,121.5276994,25.04695065
長安東二段36巷,121.5314428,25.04846292
長安東二段伊通街,121.5347326,25.04841614
長安東一段30、53巷,121.5263639,25.04873282
長安東一段林森北路,121.5245513,25.04912901
長安東一段天津街,121.5228298,25.04954303
中山北一段長安東一段,121.5216154,25.04983579
建國北三段農安街,121.5366161,25.06484767
建國北三段22巷,121.5368251,25.06376176
建國北三段75巷,121.5370183,25.06499334
建國北三段62號(匝道口),121.5362805,25.06532188
建國北三段151巷,121.5345397,25.06732537
建國北三段96號,121.5342302,25.06699746
市民二段林森北路,121.5241671,25.04777268
林森北路107巷,121.5248995,25.05032089
林森北路235巷(欣欣大眾公司),121.5254319,25.0538821
林森北路310巷,121.5254849,25.0562375
林森北路新興國中,121.5256218,25.06168461
農安街林森北路,121.5257045,25.06490656
德惠街林森北路,121.5257361,25.06666352
林森北路中山國小,121.5256939,25.06407334
樂群二路敬業四路,121.5585027,25.07991391
樂群二路敬業三路,121.5562944,25.07989791
植福路樂群二路,121.5618088,25.08003444
明水路樂群二路,121.5521052,25.07994164
樂群二路敬業一路,121.5532328,25.07992199
樂群二路214號(敬業三路162巷),121.559645,25.0798657
八德路二段渭水路,121.5355628,25.04561908
新生北一段47巷,121.5300923,25.04795647
新生北一段62巷,121.5307506,25.04693305
新生北三段農安街,121.5279336,25.06483395
新生北三段德惠街,121.5279314,25.06659907
新生北三段84巷,121.5278047,25.0669581
濱江街大直橋,121.5442746,25.07218379
濱江街大佳國小,121.535586,25.07312047
濱江街180巷,121.5384414,25.07252106
濱江街基8號水門(單閃),121.5398925,25.07260368
濱江街362號,121.5511642,25.07221656
新生北三段濱江街,121.5280431,25.0706553
濱江街150號,121.5367308,25.07255752
濱江街交流道口,121.5423802,25.07233557
濱江街高速公路涵洞,121.535831,25.07258708
濱江街高速下匝道,121.5314649,25.07203248
濱江街林安泰古厝,121.5300555,25.07142061
復興北路430巷,121.5442311,25.06335157
復興北路五常街,121.5442723,25.06428786
農安街中原街,121.5290451,25.06483505
中原街吉林路144巷,121.5288502,25.05606129
植福路樂群三路,121.5606522,25.0826139
植福路敬業四路,121.5585269,25.08390313
敬業三路植福路,121.5563195,25.08393524
樂群一路敬業三路,121.5563226,25.07714718
敬業三路162巷,121.5563158,25.07921606
樂群三路敬業三路,121.5563313,25.08263266
敬業四路樂群三路,121.558526,25.08261056
敬業一路敬業二路,121.5543936,25.08396784
敬業二路樂群三路,121.5543814,25.08266569
敬業一路樂群三路,121.5522988,25.08267056
敬業一路明水路606巷,121.5525653,25.08192842
敬業一路128巷,121.5522738,25.08343076
明水路樂群三路,121.5511247,25.08269097
樂群一路基湖路,121.5631706,25.07610986
明水路樂群一路,121.5509165,25.07731575
植福路286巷,121.5611416,25.08158354
明水路606巷,121.5513923,25.08192097
明水路475巷,121.5515547,25.07776231
新生北二段62巷,121.5273971,25.05607738
中山北三段農安街,121.5222646,25.0648855
中山北三段德惠街,121.5224437,25.06681757
中山北三段酒泉街,121.5234489,25.07071351
中山北四段1巷(上圓山飯店),121.5257622,25.07438413
中山北四段圓山隧道(上新生高匝道),121.5252972,25.07684258
龍江路345巷復興北430巷,121.5425323,25.06334143
五常街龍江路,121.5409372,25.06428884
龍江路356巷,121.540969,25.0659157
雙城街德惠街,121.5242797,25.06669328
農安街德惠街170巷,121.5317425,25.0647864
明水路北安國中,121.541616,25.07754501
明水路大直橋下,121.5445971,25.0773038
新生北二段28巷,121.5273702,25.05379398
中山北一段市民一段,121.5207375,25.04801781
新生北三段德惠街(南向),121.5276237,25.06621417
樂群二路濱江國中,121.5601919,25.07987932
市民三段八德路二段210巷,121.539536,25.04460973
市民三段安東街,121.5424019,25.04463695
建國北二段117巷,121.5371472,25.05965912
建國北二段186巷,121.5367108,25.05966829
樂群二路敬業二路,121.5543774,25.07993822
八德路二段167巷,121.5381532,25.0462881
八德路二段199、210巷,121.5391402,25.04647304
八德路二段龍江路,121.5405278,25.0467239
八德路二段安東街,121.5415147,25.04697194
八德路二段市民三段,121.5346353,25.04495492
市民二段金山北路,121.5307135,25.04602414
市民二段林森東側,121.5259425,25.04726796
市民二段5號,121.5214615,25.04796215
市民二段天津街,121.5224051,25.04791898
興安街龍江路,121.5405547,25.05608618
四平街一江街,121.5314976,25.05362203
天津街32號,121.52269,25.04904676
明水路397巷,121.5477016,25.07735169
明水路397巷,121.5477016,25.07735169
明水路397巷,121.5477016,25.07735169
信義路四段敦化南一段,121.548759,25.033318
安和路一段仁愛路四段266巷,121.552422,25.036169
延吉街光復南路456巷,121.556053,25.035055
安和路一段109巷,121.552567,25.035372
敦化南一段安和路,121.549088,25.040024
信義路四段安和路一段,121.552475,25.033171
羅斯福路4段113巷空戰司令部,121.5409669,25.01133737
基隆路四段41巷68弄公館國小,121.5428069,25.01253071
基隆路四段41巷68弄6號(台科大宿舍門口),121.5422146,25.01212089
忠孝東三段建國南一段,121.537056,25.041737
忠孝東三段217巷,121.539703,25.041626
忠孝東三段251巷,121.541634,25.041647
忠孝東三段復興南一段,121.543648,25.041595
忠孝東四段大安路一段,121.54612,25.041569
忠孝東四段118巷,121.547195,25.041559
忠孝東四段敦化南一段,121.548943,25.041517
忠孝東四段170巷,121.550812,25.041409
忠孝東四段216巷,121.55304,25.041361
忠孝東四段延吉街,121.554565,25.041391
建國南一段濟南路三段,121.537674,25.04011
仁愛路三段建國南一段,121.537903,25.037949
仁愛路三段空軍總部,121.539856,25.038033
仁愛路三段復興南一段,121.543571,25.037983
仁愛路四段大安路一段,121.546043,25.037914
仁愛路四段敦化南一段,121.54882,25.037876
東豐街四維路,121.548126,25.035982
大安路一段東豐街,121.546028,25.036007
復興南一段東豐街,121.543648,25.036032
和平東三段敦化南二段,121.548744,25.024597
四維路170巷,121.547997,25.028166
敦化南二段81巷45弄,121.550438,25.029919
敦化南二段54、63號,121.5487492,25.03098218
敦化南二段63巷21弄,121.5501064,25.03093544
敦化南二段63巷53、54弄,121.551564,25.03097588
敦化南二段96、107巷,121.548752,25.028128
新生南二段金華街,121.533737,25.030615
建國南一段258巷,121.537468,25.036816
建國南一段延平中學,121.538261,25.036341
辛亥路三段停車場,121.552818,25.014635
辛亥路三段第二殯儀館,121.552589,25.014368
辛亥路三段284巷,121.551308,25.015236
辛亥路三段青峰里公園,121.551483,25.015444
基隆路三段長興街,121.544334,25.017212
基隆路四段144巷,121.539505,25.013123
基隆路四段科技大學,121.540512,25.013832
芳蘭路基隆路三段155巷,121.54509,25.012552
基隆路三段156、155巷,121.542679,25.015659
臥龍街富陽街,121.5568644,25.01853662
仁愛路四段266巷8弄,121.552933,25.037027
建國南一段新生南一段161巷,121.5375942,25.03448598
復興南一段84、107巷,121.543961,25.043631
復興南一段196、201號,121.543785,25.039818
信義路三段復興南一段,121.543472,25.033367
敦化南一段190、187巷,121.548996,25.042587
仁愛路四段敦化南一段(南側),121.54882,25.037024
敦化南一段314、295號,121.548798,25.035561
仁愛路四段安和路一段,121.551208,25.037914
仁愛路四段延吉街,121.55555,25.037676
延吉街233巷,121.5555454,25.03701088
信義路三段建國南一段,121.537788,25.033455
仁愛路四段266巷,121.55294,25.037704
安和路二段文昌街,121.552429,25.032589
文昌街通安街,121.5533256,25.03253311
通化街文昌街,121.5542862,25.03243306
文昌街信義路四段186巷,121.55162,25.032677
信義路四段186巷,121.5516017,25.03323021
安和路二段52、59巷,121.5524443,25.03097586
信義路四段186巷東方工商,121.551575,25.032192
和平東二段復興南二段,121.543388,25.02483
基隆路三段辛亥路二段,121.546417,25.019093
基隆路三段樂業街,121.55024,25.022377
基隆路三段敦化南二段,121.548492,25.020815
敦化南二段200、319號,121.548691,25.022799
敦化南二段遠企中心,121.548744,25.026884
敦化南二段81巷,121.5488378,25.0299783
復興南二段瑞安街,121.5435532,25.02992523
復興南二段78、53巷,121.5435761,25.03108746
金山南二段金華街,121.526543,25.030195
基隆路四段羅斯福四段,121.5372789,25.01108247
瑞安街180巷,121.5412154,25.02851384
愛國東路79巷(加油站),121.527451,25.031595
仁愛路三段123巷,121.541954,25.03817
羅斯福四段113巷民族國中,121.5388867,25.01131303
金華街青田街,121.5315482,25.03002101
金華街永康街,121.5295213,25.02977532
金華街164巷,121.53064,25.029789
金華街麗水街,121.5285318,25.02988053
信義路三段134巷建國南二段151巷,121.539383,25.028774
信義路三段134巷建國南二段69巷,121.539429,25.031158
大安路二段建安國小,121.546043,25.029383
金山南二段潮州街,121.526321,25.028885
信義路四段通化街,121.554352,25.033136
愛國東路電信,121.525452,25.031895
愛國東路21、210巷,121.524033,25.032122
信義路三段134巷,121.539444,25.033474
信義路三段43號,121.5358125,25.03350301
信義路三段166巷,121.541862,25.03343
臥龍街306號,121.5598831,25.01678558
臥龍街260號,121.5578544,25.01779345
和平東三段632、636巷,121.5634106,25.01289429
和平東三段627、631巷,121.5632769,25.01329234
和平東三段530巷(公車麟光站),121.5610515,25.01556275
和平東三段596、599號,121.5623681,25.0142035
臥龍街276、293號,121.5583847,25.01703367
臥龍街151巷辛亥路三段157巷,121.550865,25.018345
臥龍街和平東三段406巷(加油站),121.5573989,25.01844534
臥龍街樂業街,121.554588,25.018696
新生南三段94、98巷,121.5333305,25.01702076
新生南三段台大側門,121.5337085,25.01876749
新生南三段56巷,121.534004,25.020426
新生南三段龍安國小,121.5346414,25.02407809
新生南二段青田街,121.5345202,25.02833596
辛亥路三段157巷,121.549126,25.017115
辛亥路二段復興南二段,121.543365,25.021276
辛亥路二段171巷,121.5411063,25.02136205
辛亥路一段泰順街,121.531784,25.021885
辛亥路一段139巷對側,121.5326453,25.02209292
辛亥路一段139巷,121.5325686,25.02233672
辛亥路一段溫州街,121.5331966,25.02242734
辛亥路一段新生南三段,121.534416,25.022448
辛亥路二段建國南二段,121.537592,25.02282579
安居街108巷臥龍街151巷,121.551689,25.019463
安居街樂業街,121.553459,25.019667
和平東三段416巷(出城),121.559158,25.018082
和平東三段463巷(入城),121.558975,25.018467
和平東三段臥龍街316號,121.5602211,25.0164747
和平東三段464、509巷,121.5601323,25.01706118
和平東三段391巷,121.5575217,25.01966595
和平東三段406巷,121.5584289,25.01880812
和平東三段富陽街,121.5565561,25.02054907
和平東三段安居街,121.555489,25.021475
師大路39巷,121.5285654,25.02463458
師大路80巷,121.5284465,25.02330739
樂業街臥龍街151巷,121.552689,25.020329
復興南二段340巷,121.543312,25.022711
復興南二段337、308巷,121.543381,25.023573
復興南二段148、151巷,121.543488,25.028368
復興南二段160、171巷,121.5434641,25.02776363
復興南二段148巷開平中學,121.542,25.028421
復興南二段210、193號,121.543343,25.026501
復興南一段295巷,121.543755,25.035103
和平東三段信安街,121.554695,25.022444
和平東三段嘉興街,121.553963,25.023026
和平東三段基隆路二段,121.552513,25.024332
和平東三段安和路二段,121.550453,25.024479
和平東三段臥龍街,121.546661,25.024593
和平東二段科技大樓,121.5417263,25.02509691
和平東二段107巷,121.540184,25.025269
和平東二段90巷龍門國中,121.5395197,25.02380961
和平東二段瑞安街,121.538841,25.025469
和平東二段建國南二段,121.537651,25.025663
和平東一段新生南二段,121.534828,25.026049
和平東一段溫州街,121.5336268,25.02625375
和平東一段泰順街,121.531739,25.02637953
和平東一段師大路,121.528511,25.026571
和平東一段141巷,121.5304064,25.0265053
和平東一段師大大門,121.5275698,25.02665989
和平東一段金山南二段,121.525932,25.026791
和平東一段41巷,121.523926,25.02693
和平東二段311巷(國立台北師院),121.545044,25.024656
安和路二段227巷,121.550331,25.025358
安和路二段189巷,121.5498737,25.02687799
樂利路安和路二段171巷,121.551147,25.02813
安和路二段樂利路,121.5507729,25.02903574
安和路二段立人小學,121.551743,25.02984
安和路二段171、108號,121.550568,25.027939
樂利路通化街,121.552071,25.025854
建國南一段65巷,121.536888,25.043921
建國南一段101巷,121.5366713,25.04329721
建國南一段341巷,121.537979,25.034424
建國南二段151巷,121.5377303,25.02884002
建國南一段175巷,121.5374531,25.04078539
建國南二段瑞安街256巷(東),121.5379853,25.02770689
建國南二段瑞安街256巷(西),121.5374461,25.02771585
建國南二段陽光洗車,121.5376465,25.02496698
建國南二段79巷,121.5379963,25.03080308
建國南二段陽光加油站,121.5375242,25.03080773
建國南二段信義南側迴轉道(東),121.5380493,25.03234555
建國南二段信義南側迴轉道(西),121.5375246,25.03235996
四維路192巷,121.547989,25.02706
四維路154巷,121.547958,25.030954
四維路76巷(單閃),121.548103,25.034191
通化街171巷,121.553619,25.02804
樂利路11巷通安街,121.5526314,25.02831968
大安路二段174號,121.546013,25.028246
大安路二段55、100號,121.5460486,25.03101617
大安路一段113、116巷,121.546074,25.039761
潮州街麗水街(單閃),121.5283097,25.02857334
潮州街59巷,121.5241797,25.02927652
臨江街通化街,121.554268,25.030113
信義路四段大安路,121.545998,25.033293
愛國東路麗水街,121.528839,25.031357
金山南二段31巷,121.5270869,25.0330193
金山南二段愛國東路,121.5268373,25.03166658
仁愛路三段幸安國小,121.535133,25.03771
仁愛路四段27巷大安路一段116巷,121.545212,25.039787
市民延吉街南側停車場,121.553857,25.04395492
延吉街70巷,121.5541725,25.04258985
安和路二段209巷,121.5500285,25.0261644
芳蘭路長興街(自來水廠),121.5474342,25.0150004
忠孝東三段-臺北科技大學,121.5354236,25.04194664
重慶北三段113巷,121.5136826,25.06723971
重慶北三段昌吉街,121.5136466,25.06593072
重慶北三段伊寧街,121.5136623,25.06463981
重慶北二段民權西路,121.5135441,25.06291366
重慶北二段64巷,121.5139059,25.05597806
重慶北一段南京西路,121.5144294,25.05401925
重慶北一段長安西路,121.5139375,25.05159519
重慶北一段華陰街,121.5136412,25.05066926
重慶北一段市民一段,121.513383,25.04947419
重慶北三段酒泉街,121.5137857,25.07207819
重慶北三段哈密街,121.5138277,25.07291913
延平北二段涼州街,121.5113385,25.06063215
承德路二段錦西街,121.5182242,25.06018101
承德路二段民生西路,121.5181594,25.05732582
延平北三段昌吉街,121.5110337,25.06590959
承德路三段庫倫街,121.5186086,25.07191716
長安西路太原路,121.5154378,25.05126139
延平北一段市民一段,121.5119746,25.04991659
承德路三段敦煌路,121.520088,25.07528093
玉門街敦煌路,121.5211545,25.07487325
承德路二段民權西路,121.5182784,25.06288168
承德路三段民族西路,121.5184201,25.06856354
重慶北二段涼州街,121.5135678,25.06073078
長安西路華亭街,121.5132558,25.05175219
延平北一段長安西路,121.5118827,25.05205093
延平北一段南京西路,121.5117599,25.05386863
承德路一段市民一段,121.5164145,25.04876919
長安西路捷運淡水線,121.520089,25.05016784
長安西路70號,121.5195776,25.05031635
長安西路南京西路64巷,121.5182293,25.05061615
承德路一段長安西路,121.5170337,25.05087622
重慶北二段保安街,121.5136211,25.05924953
錦西街寧夏路,121.5147884,25.05944502
涼州街寧夏路,121.5143415,25.06081515
寧夏路靜修女中,121.515313,25.05788247
重慶北二段歸綏街,121.5136516,25.05821932
民生西路寧夏路,121.5155153,25.05703434
重慶北二段民生西路,121.5137379,25.056972
環河北二段民族西路,121.5091429,25.06869429
延平北三段民族西路,121.5108712,25.06867642
民族西路252巷,121.5122537,25.06865755
重慶北三段民族西路,121.5137449,25.06862692
民族西路大龍街,121.5158726,25.06858583
民族西路127巷,121.51679,25.06857864
民族西路玉門街,121.5197912,25.0685295
酒泉街圓山捷運站,121.5199356,25.07059664
庫倫街圓山捷運站,121.5200943,25.07181632
民權西路蘭州路,121.5147225,25.06298894
民權西路大龍街,121.5159443,25.06293995
環河北一段民生西路,121.5082153,25.05683228
民生西路民樂街,121.5107474,25.05693236
民生西路迪化街一段,121.5098388,25.05689141
民生西路西寧北路,121.5089586,25.05688795
民權西路225巷,121.5121485,25.06294087
延平北二段民權西路(母),121.5113816,25.06269872
民權西路延平北北側,121.5112584,25.06303437
延平北四段酒泉街,121.5109706,25.07211754
延平北四段迪化街二段364巷,121.5112412,25.07301163
延平北四段235巷,121.5118585,25.07588871
延平北四段迪化公園,121.5114178,25.07412229
承德路三段昌吉街,121.5183282,25.06587565
承德路二段成淵中學,121.5182428,25.06154094
承德路一段南京西路,121.5177026,25.0532392
承德路一段華陰街,121.5167707,25.04992417
